{"authorities":{"documentationSourceInventory":{"artifactByteLength":493939,"artifactSha256":"sha256:d533a2f96046b484f192ed88ab70fa31d5620d48ebd647c72ec3008998f8f77c","inventoryDigest":"sha256:bbd9c3b77aac4d6ee64d7b185a5acd85eabeb40c621114126ff210bd7150fcc8","path":"docs/audit/nest-documentation-source-inventory.v1.json","protocol":"cortexel-nest-documentation-source-inventory","protocolVersion":1},"exampleSourceInventory":{"artifactByteLength":228211,"artifactSha256":"sha256:a8a7da4c62170a5405da3662dbef2602891c87cadbadd7f897196be6966928cd","inventoryDigest":"sha256:1f039d9b4616ffa2de0c2acb6ca4ef9eaf473185b044a66bd8e6bbea27b1d216","path":"docs/audit/nest-example-source-inventory.v2.json","protocol":"cortexel-nest-example-source-inventory","protocolVersion":2},"predecessor":{"artifactByteLength":23522,"artifactSha256":"sha256:21822081873157b58b93f449e914d6bee0f102b1590670ac568a7a6e5060853c","evidenceTransfer":"source_authority_only_no_visualization_evidence","path":"docs/audit/nest-example-coverage.v1.json","semanticDigest":"sha256:1ac8b2b440e333c8be8fe250545c4ab8e8525f7664a5448e5390135c41a090fc"}},"axisSemantics":{"executableAdapter":"Only the exact nest-spike-recorder.v5 profile is packaged. No official example is asserted to satisfy that profile until a detached capture and receipt bind the example-specific source authority.","renderer":"A packaged renderer candidate can render its validated stable skill. It has not been compared with an execution-bound upstream example output.","scientificCertification":"Every demand remains NOT_RUN; source review and structural rendering do not certify scientific equivalence.","stableRepresentability":"A source-review candidate means only that a stable skill appears capable of carrying the named semantic demand. It is not an admitted example mapping or a claim about output bytes.","upstreamParity":"Every demand remains NOT_RUN against pinned upstream output."},"canonicalExamples":[{"aliasPaths":[],"byteLength":4122,"canonicalSourceId":"sha256:4dd8b373ef45840120cc47c03a82e8bba7be191817e079255f70fb1b497b3563","documentationSelectedPaths":["pynest/examples/BrodyHopfield.py"],"entrypointId":"sha256:1e2ed8ecf5c4cd59e527b44b0390a13414a254caba8a19be58cbf1c387a0b1d9","gitBlobSha1":"66c1357a91e2a6df3d64be58f34409711178578f","gitMode":"100755","path":"pynest/examples/BrodyHopfield.py","presentationDemands":["single_panel"],"runnerSelectedPaths":["pynest/examples/BrodyHopfield.py"],"selectorMembership":["docs_direct","runner_candidate","runner_default"],"semanticDemands":["spike_raster"],"sha256":"sha256:7ece67dd0f85e9f02ad7cee8ed37bf22f4ddf9fc2f528a08457097a992b16eaf","sourceEvidence":{"lineAnchorMeaning":"review_navigation_only_full_source_hash_is_the_byte_authority","lineAnchors":[113],"state":"complete_pinned_source_body_review_not_executed"},"sourceId":"sha256:4dd8b373ef45840120cc47c03a82e8bba7be191817e079255f70fb1b497b3563","visualOperations":["raster"],"visualizationStatus":"active_visualization"},{"aliasPaths":[],"byteLength":7244,"canonicalSourceId":"sha256:b6e9d9f3b6755d1405486555b36169956fee4be31fd7932aa82086b9c59f38b8","documentationSelectedPaths":["pynest/examples/CampbellSiegert.py"],"entrypointId":"sha256:b8a8217c365abd02629ba0192f7786394029efd0781ebbc5a694bf61087ed61e","gitBlobSha1":"ac13f2c08050f0432e8e1f389c68b0951ec48cbc","gitMode":"100755","path":"pynest/examples/CampbellSiegert.py","presentationDemands":[],"runnerSelectedPaths":["pynest/examples/CampbellSiegert.py"],"selectorMembership":["docs_direct","runner_candidate","runner_default"],"semanticDemands":[],"sha256":"sha256:c2d2ea90feadf90599b3d666333ea69dd6b448fd5fe1b8631180ade8673a76ac","sourceEvidence":{"lineAnchorMeaning":"review_navigation_only_full_source_hash_is_the_byte_authority","lineAnchors":[],"state":"complete_pinned_source_body_review_not_executed"},"sourceId":"sha256:b6e9d9f3b6755d1405486555b36169956fee4be31fd7932aa82086b9c59f38b8","visualOperations":[],"visualizationStatus":"no_visualization_operation"},{"aliasPaths":["pynest/examples/EI_clustered_network/run_example.py"],"byteLength":2024,"canonicalSourceId":"sha256:1595faa52a09fdde3979f9e4dc37b15eec67eaee4c20b00db7dff2d62859abb7","documentationSelectedPaths":[],"entrypointId":"sha256:f5dd9d5e46c83849219ade34694f34b96cc1371f61127d5a08ee9389954dc2dc","gitBlobSha1":"ecafa112df45cc55f898447447ca49dc842a451a","gitMode":"100644","path":"pynest/examples/EI_clustered_network/run_simulation.py","presentationDemands":["single_panel","static_file_export"],"runnerSelectedPaths":["pynest/examples/EI_clustered_network/run_example.py"],"selectorMembership":[],"semanticDemands":["spike_raster"],"sha256":"sha256:a15e6606e2e6afa48b747fc27c4c7bf6cc1b4938fc055331e1a7d180a3a22be2","sourceEvidence":{"lineAnchorMeaning":"review_navigation_only_full_source_hash_is_the_byte_authority","lineAnchors":[46,54],"state":"complete_pinned_source_body_review_not_executed"},"sourceId":"sha256:1595faa52a09fdde3979f9e4dc37b15eec67eaee4c20b00db7dff2d62859abb7","visualOperations":["raster"],"visualizationStatus":"active_visualization"},{"aliasPaths":[],"byteLength":1775,"canonicalSourceId":"sha256:9367a0c8d467f6735c9abfabfa5f8c7c8f39eb4780502649349990b7e8116cb9","documentationSelectedPaths":["pynest/examples/aeif_cond_beta_multisynapse.py"],"entrypointId":"sha256:d0c22b68d9d2fecf30322996d46bb83ed719e852a710569d7647bdffc8eae508","gitBlobSha1":"e398d92db05105f4de7782d708ffd8debdfcf8f0","gitMode":"100644","path":"pynest/examples/aeif_cond_beta_multisynapse.py","presentationDemands":["single_panel"],"runnerSelectedPaths":["pynest/examples/aeif_cond_beta_multisynapse.py"],"selectorMembership":["docs_direct","runner_candidate","runner_default"],"semanticDemands":["analog_trace"],"sha256":"sha256:82e407dc03fad51d2872dc984a9022c1bb77bedf85cad567ace56577842d11ff","sourceEvidence":{"lineAnchorMeaning":"review_navigation_only_full_source_hash_is_the_byte_authority","lineAnchors":[64],"state":"complete_pinned_source_body_review_not_executed"},"sourceId":"sha256:9367a0c8d467f6735c9abfabfa5f8c7c8f39eb4780502649349990b7e8116cb9","visualOperations":["line"],"visualizationStatus":"active_visualization"},{"aliasPaths":[],"byteLength":12256,"canonicalSourceId":"sha256:1843aad6f45836c3883ff711a1d66d69b5c4999851e799f559f5e8092e481a54","documentationSelectedPaths":["pynest/examples/artificial_synchrony.py"],"entrypointId":"sha256:6058b979ea0d322c8e510679f973cc1f40946e9c1d449195096980465d80582f","gitBlobSha1":"e1d3037166c294d740141cab2072fc02ff4986e3","gitMode":"100644","path":"pynest/examples/artificial_synchrony.py","presentationDemands":["same_axis_overlay","single_panel"],"runnerSelectedPaths":["pynest/examples/artificial_synchrony.py"],"selectorMembership":["docs_direct","runner_candidate","runner_default"],"semanticDemands":["response_curve"],"sha256":"sha256:2d595437953fcda8b0c1bdff84f0af166dd75672c76d08bb4f4f9ee67c388826","sourceEvidence":{"lineAnchorMeaning":"review_navigation_only_full_source_hash_is_the_byte_authority","lineAnchors":[352,353],"state":"complete_pinned_source_body_review_not_executed"},"sourceId":"sha256:1843aad6f45836c3883ff711a1d66d69b5c4999851e799f559f5e8092e481a54","visualOperations":["line","point"],"visualizationStatus":"active_visualization"},{"aliasPaths":[],"byteLength":14765,"canonicalSourceId":"sha256:71af2d628a448204999777b6f4999e9337e4a06dc1fa96ee67b0d5be15ed6619","documentationSelectedPaths":["pynest/examples/astrocytes/astrocyte_brunel_bernoulli.py"],"entrypointId":"sha256:7009f83d5d288bd58e69847d6af0cb770dd71d87256f7fc3fba101218d25012f","gitBlobSha1":"cee744e37ac2e842aa677536629ec91494a0f6d5","gitMode":"100644","path":"pynest/examples/astrocytes/astrocyte_brunel_bernoulli.py","presentationDemands":["cross_capability_bundle","dual_y_axis","multi_panel","uncertainty_band"],"runnerSelectedPaths":["pynest/examples/astrocytes/astrocyte_brunel_bernoulli.py"],"selectorMembership":["docs_direct","runner_candidate","runner_default"],"semanticDemands":["population_rate","population_summary_trace","spike_raster"],"sha256":"sha256:6ed916d45e39e5865454acb7469d541052bf0e6b01c16b0c7c3c88caf28fe530","sourceEvidence":{"lineAnchorMeaning":"review_navigation_only_full_source_hash_is_the_byte_authority","lineAnchors":[281,363],"state":"complete_pinned_source_body_review_not_executed"},"sourceId":"sha256:71af2d628a448204999777b6f4999e9337e4a06dc1fa96ee67b0d5be15ed6619","visualOperations":["filled_band","histogram","line","raster"],"visualizationStatus":"active_visualization"},{"aliasPaths":[],"byteLength":14659,"canonicalSourceId":"sha256:7948ea0487687415b1367051b33b29979bc663c7b5b43e8339678d150d495603","documentationSelectedPaths":["pynest/examples/astrocytes/astrocyte_brunel_fixed_indegree.py"],"entrypointId":"sha256:ee61caecfaa26eae73ff7804eb21865a2014c81463f032b52bc6b1ca2ee6ff41","gitBlobSha1":"98f0eedd7d1f1e9f7bde2c5b9def3daf7d757b24","gitMode":"100644","path":"pynest/examples/astrocytes/astrocyte_brunel_fixed_indegree.py","presentationDemands":["cross_capability_bundle","dual_y_axis","multi_panel","uncertainty_band"],"runnerSelectedPaths":["pynest/examples/astrocytes/astrocyte_brunel_fixed_indegree.py"],"selectorMembership":["docs_direct","runner_candidate","runner_default"],"semanticDemands":["population_rate","population_summary_trace","spike_raster"],"sha256":"sha256:99180ee29d59796d53be51a7a9515f94c51acdea5396d24515a4c5d674de5f30","sourceEvidence":{"lineAnchorMeaning":"review_navigation_only_full_source_hash_is_the_byte_authority","lineAnchors":[278,360],"state":"complete_pinned_source_body_review_not_executed"},"sourceId":"sha256:7948ea0487687415b1367051b33b29979bc663c7b5b43e8339678d150d495603","visualOperations":["filled_band","histogram","line","raster"],"visualizationStatus":"active_visualization"},{"aliasPaths":[],"byteLength":5951,"canonicalSourceId":"sha256:7a213c2b70841e553f651a7fc59a3ea5c45b5c20ffbab2d3f03ff3d76d1f2f05","documentationSelectedPaths":["pynest/examples/astrocytes/astrocyte_interaction.py"],"entrypointId":"sha256:9cc8776994ca0c7570aea506da05bca0b5d463f